{
  "schema_version": "recognized-external-determination-v0.1",
  "determination_id": "szutest:biotrh:certificate-withdrawal:2023-05-02",
  "character": "RECOGNIZED_EXTERNAL_DETERMINATION",
  "originator": {
    "actor_id": "szutest-nb-2195",
    "label": "SZUTEST Uygunluk Değerlendirme A.Ş.",
    "originator_character": "PRIVATE_ENTITY",
    "external_identifier": "NB 2195"
  },
  "recognition": {
    "role_label": "Notified Body",
    "recognition_character": "DESIGNATED_CONFORMITY_ASSESSOR",
    "scope_statement": "Directive 93/42/EEC gives designated notified bodies bounded conformity-assessment and certificate suspension/withdrawal functions.",
    "public_law_refs": [
      {
        "identifier": "CELEX:31993L0042",
        "locator": "Article 16(1), (5), (6)",
        "role": "RECOGNITION_BASIS"
      }
    ]
  },
  "subject_ref": {
    "kind": "MEDICAL_DEVICE_CERTIFICATE",
    "identifier": "biotrh-los-deline-ce-certificate",
    "label": "BIOTRH Los Deline CE certificate(s)"
  },
  "determination_kind": "CERTIFICATE_STATUS_TRANSITION",
  "determination_date": "2023-05-02",
  "transition": {
    "operation": "WITHDRAW",
    "before": "SUSPENDED",
    "after": "WITHDRAWN"
  },
  "evidence_state": "ATTRIBUTED",
  "source_refs": [
    {
      "source_origin": "PUBLIC_OFFICIAL",
      "identifier": "Swissmedic-hosted FSN/FSCA-23-002-PR",
      "locator": "pages 2-3, withdrawal decision dated 2 May 2023",
      "role": "ATTRIBUTED_DETERMINATION"
    }
  ],
  "legal_relevance": {
    "statement": "Within the recognized conformity-assessment role, a notified body may withdraw a certificate where Directive requirements are no longer met unless corrective measures restore compliance.",
    "consequence_character": "DIRECT_WITHIN_RECOGNIZED_ROLE",
    "public_law_refs": [
      {
        "identifier": "CELEX:31993L0042",
        "locator": "Article 16(6)",
        "role": "STATUS_POWER"
      }
    ]
  },
  "guardrails": [
    "The manufacturer's appeal does not erase the existence of the withdrawal decision.",
    "The determination is not merged with later competent-authority action or recall.",
    "The underlying notified-body decision document is not claimed as directly observed."
  ],
  "notes": "Private-origin proof case #2b from Issue #85."
}
